{
  "schemaVersion": 1,
  "kind": "task",
  "title": "CORE-7108 \u00b7 SITEWIDE body base font \u2014 VERIFIED, true in source, zero visible impact",
  "body": "**Linear:** [CORE-7108](https://linear.app/bsq-group/issue/CORE-7108)\n\n**Report:** `reports/T35-CORE-7108-verification.md`\n\n**Premise true at the `<body>` level, but no rendered text is affected. Not a rendering defect. No PR.**\n\n| | live | clone |\n|---|---|---|\n| `<body>` font-family | `myriad-pro-semi-condensed, verdana-fallback, Geneva, Tahoma, sans-serif` | `Inter, \"Inter Fallback\"` |\n| `<body>` size / line-height | **18px / 27px** | **16px / 24px** |\n\n## But nothing inherits it\n\nEvery visible text-bearing element outside header/footer/nav, grouped by resolved family:\n\n| page | width | elements | chars | Myriad | Inter |\n|---|---|---|---|---|---|\n| live `/` | 1440 | 261 | 18,582 | **100%** | 0 |\n| clone `/` | 1440 | 262 | 19,045 | **100%** | 0 |\n| live `/` | 360 | 260 | 18,572 | **100%** | 0 |\n| clone `/` | 360 | 261 | 19,035 | **100%** | 0 |\n| clone `/privacy-policy` | 1440 | 326 | 32,151 | **100%** | 0 |\n| clone `/id-requirements` | 1440 | 27 | 2,717 | **100%** | 0 |\n| clone `/site-map` | 1440 | 85 | 1,477 | **100%** | 0 |\n| clone `/a-z-glossary-of-terms` | 1440 | 176 | 17,818 | **100%** | 0 |\n\nRich-text-heavy pages chosen deliberately as the likeliest place for a missed opt-in. There is none.\nSize distributions match, and the two shared homepage headings are identical on both sites\n(`36px/44.46px w400` at 1440 and 360).\n\nFace resolution proved by canvas fingerprinting against 11 candidate families: live `<body>` renders\n468.79px for a fixed sample and `myriad-pro-semi-condensed` measures **468.79px exactly**; every other\ncandidate is 22-214px away.\n\n## Not a licensing matter\n\nMyriad is already licensed and wired: `layout.tsx` injects the Adobe Typekit kit gated on\n`NEXT_PUBLIC_ADOBE_FONT_PROJECT_ID` (`wrj3hpa` in `.env`). The local build emits the Typekit `<link>`.\nApplied opt-in per element via `.font-legacy-condensed` (`globals.css:626-630`), 76 occurrences across\n74 files.\n\n## The real risk, already documented\n\n`.claude/QCF_GOTCHAS.md` records an actual incident on this exact variable: absent in Vercel, so the\n`{adobeFontProjectId && (...)}` branch never emitted the Typekit `<link>` and **the whole deployed site\nfell back to Inter with a green build**. `NEXT_PUBLIC_*` is inlined at build time, so adding the variable\nrequires a **redeploy**. That is a deployment-config concern, not a code defect.\n\n**Action worth more than any code change:** confirm the deployed HTML still contains the Typekit link.\n`curl -s <deployed-url>/ | grep -c typekit` \u2014 0 means the variable never reached the build. I could not\nrun it: the Vercel URL sits behind the SSO wall and answers HTTP 200 with a login page.\n\n## Why the base declaration was NOT changed\n\nAdding the Myriad stack to `body` would be provably zero-visual-change today, but fixes nothing real:\nit does not mitigate the env-var hazard (if Typekit fails, Myriad is unavailable wherever declared), and\nit would only change what the site falls back **to** \u2014 and Encode Sans is a *closer* metric match to\nMyriad Semi Condensed than live's Verdana chain, so copying live would arguably make degraded rendering\nworse. A sitewide base-typography declaration is the highest-blast-radius change in this repo; not worth\nit on agent judgement.\n\n## Correction: the 305-vs-320 observation was an artefact\n\nAn earlier draft logged a 15px container-width difference at 360. **Wrong** \u2014 live probes ran headed and\nclone probes headless, and headed Chrome's 15px classic scrollbar reduces content width where headless\noverlay scrollbars do not. Holding page and viewport fixed and varying only the mode: live headed 305,\nlive headless 320, clone headless 320, clone headed 305. With modes matched the sites agree exactly;\nthere is no gutter defect.\n\nNo conclusion above is affected \u2014 every font verdict rests on fixed-pixel values and character counts,\nwhich read identically in either mode. **Method note: run both sites in the SAME browser mode.**",
  "acceptanceCriteria": [
    "Ticket closed or re-scoped \u2014 no rendered text is Inter on either site.",
    "Deployment check raised: assert the Typekit <link> is present in the deployed HTML (ideally in CI).",
    "If a base font-family declaration is still wanted, it is reviewed as a typography decision, not a bug fix.",
    "Method note recorded: compare live and clone in the same browser mode (headed/headless scrollbar skews widths by 15px)."
  ],
  "status": "backlog",
  "track": "clone",
  "tags": [
    "bug"
  ],
  "priority": "normal",
  "effort": "M",
  "machine": "LOCAL",
  "slug": null,
  "blocks": [],
  "deps": [],
  "multiBlockApproved": false,
  "owner": null,
  "supersededBy": null,
  "createdAt": "2026-08-25T13:48:35.455718Z",
  "createdBy": "planning",
  "updatedAt": "2026-08-25T13:48:35.455718Z",
  "startedAt": null,
  "completedAt": null,
  "statusHistory": [
    {
      "status": "backlog",
      "at": "2026-08-25T13:48:35.455718Z",
      "by": "planning"
    }
  ],
  "qa": null,
  "ready": null,
  "livecheck": null,
  "needsManual": null,
  "userVerified": null,
  "report": null,
  "pr": null,
  "merge": null,
  "rejections": [],
  "proposalSource": null,
  "parent": null,
  "id": "T35",
  "num": 35
}