{
  "schemaVersion": 1,
  "kind": "task",
  "title": "CORE-6962 · Package ⓘ & bank-partner popups: desktop click + tablet tap + modal styling",
  "body": "**Linear:** [CORE-6962](https://linear.app/bsq-group/issue/CORE-6962/rf-package-and-bank-partner-popups-desktop-click-doesnt-open-styled) · state `In Progress` · priority P2\n\n## Ticket (verbatim from Linear)\n\n**Page:** `/`\n**Live:** [https://www.rapidformations.co.uk/](<https://www.rapidformations.co.uk/>)  ·  **Test:** [https://rapid-formations-clone.vercel.app/](<https://rapid-formations-clone.vercel.app/>)\n**Component/area:** Package info icons (ⓘ) in \"Find the perfect company formation package\"; \"Our business banking partners\" cards\n**Breakpoints:** 1800 / 1024 (desktop) · 768 (tablet) · 360 (mobile)\n\n**Issue** — The clone rebuilt these popups differently from Live. Live shows a **hover tooltip on desktop** and a **tap-to-open modal on touch**. On the clone: a **desktop click doesn't open** either popup, the **package ⓘ also fails to open on tablet (768)**, and where a modal does open the **styling differs** from Live.\n\n### What's wrong  (Expected = Live / Actual = Clone)\n\n| Trigger | Breakpoint | Live | Clone |\n| -- | -- | -- | -- |\n| Package ⓘ | 1800 / 1024 (desktop) | hover shows tooltip, stays | hover shows popup, but a **click closes it** → click never opens |\n| Package ⓘ | 768 (tablet) | **tap opens a modal** | **tap does nothing** — renders a hover-only variant at ≥768 (no `aria-haspopup`) |\n| Package ⓘ | 360 (mobile) | tap opens modal | tap opens modal ✓ (works) |\n| Bank-partner card | 1800 / 1024 (desktop) | hover shows tooltip (hover-driven) | hover works; **desktop click opens nothing** |\n| Bank-partner card | 768 / 360 (touch) | tap opens modal | tap opens modal ✓ (works) |\n\n**Modal styling (where a modal opens):** Live's modal has a **red ✕** (#e74c3c) and a light grey border; the clone's modal has a **grey ✕** and no border (subtle shadow only). Content and backdrop otherwise match.\n\n**Desktop-click — needs reviewer confirmation:** an automated test found that on **Live**, both the package ⓘ and the bank-partner card are **hover tooltips** that do **not** stay open after a click + mouse-away. If Live does persist on click (as observed by the reviewer), the clone's desktop click failure is a real gap; if Live is hover-only, desktop behaviour matches and the confirmed defects are the **tablet (768) package ⓘ dead-on-tap** and the **modal styling**. Please confirm the Live desktop click behaviour.\n\n**Steps to navigate**\n\n* **Desktop (1800 / 1024):** hover a package ⓘ / bank-partner card → popup shows. Now **click** it → **Live:** opens / stays. **Clone:** nothing opens.\n* **Tablet (768):** tap a package ⓘ → **Live:** modal opens. **Clone:** nothing. (Bank-partner cards open a modal on both — fine at 768.)\n* **Mobile (360):** tap → both open a modal; compare the ✕ colour and border.\n\n### Evidence\n\n**Desktop @1800 — after click**\n\n|  | Live | Clone |\n| -- | -- | -- |\n| Package ⓘ |  |  |\n| Bank-partner card |  |  |\n\n**Tablet @768 — package ⓘ after tap**\n\n| Live (modal opens) | Clone (nothing opens) |\n| -- | -- |\n|  |  |\n\n### Definition of Done\n\n- [ ] Package ⓘ and bank-partner popups open on the same interaction as Live at every breakpoint (desktop **click** works; package ⓘ opens on **tablet** tap).\n- [ ] Where a modal opens, its styling matches Live (red ✕, light grey border).\n- [ ] Mobile (360) already opens on both — keep working, just align styling.\n- [ ] Hover / focus / active states checked.\n- [ ] No visual regressions introduced.\n\n---\n### Planning note\nThe ticket leaves ONE question open (\"Please confirm the Live desktop click behaviour\"). It is not a judgment call — it is an observation, so AC1 makes measuring it on live in a headed browser part of the task and AC2 makes the fix conditional on the answer. The tablet-tap and modal-styling defects are confirmed and unconditional.\n\n---\n### Routing note (Planning)\n`rapid-formations-clone` has **no clone engine** — no `walk-dom-cdp.ts` / `emit-block.ts` /\n`verify-clone.ts`, and zero `*Clone` blocks. Every block here is hand-authored, so the\nengine-first rule has nothing to diagnose into: this is a **direct fix in the block that\nhas the defect**. That is why the task is tagged `bug` — it is NOT a fidelity loophole.\n\n**Ship path:** Mode X — `clone-pull-request-create` with per-breakpoint PROD-vs-clone\nscreenshot proof, land `awaiting-user`, **the USER merges the PR**. Never merge to main.\nLive source of truth: `https://www.rapidformations.co.uk` · clone:\n`https://rapid-formations-clone.vercel.app`. ⛔ HEADED browser only for any visual check.",
  "acceptanceCriteria": [
    "Live's desktop (1800/1024) click behaviour for the package ⓘ and bank-partner card is confirmed in a HEADED browser and recorded in the PR body — the ticket flags automated results (hover-only) as contradicting the reviewer.",
    "Clone matches whatever live does on desktop click: if live persists on click, clone opens/persists; if live is hover-only, clone's current hover-only behaviour is documented as already-matching (no change).",
    "Package ⓘ opens on TABLET (768) tap — currently dead (clone renders a hover-only variant at ≥768 with no `aria-haspopup`). Live opens a modal.",
    "Where a modal opens, styling matches live: red ✕ (#e74c3c) and light grey border (clone currently grey ✕, no border).",
    "Mobile (360) keeps working for both triggers; hover/focus/active states checked; no visual regressions."
  ],
  "status": "running",
  "track": "clone",
  "tags": [
    "bug",
    "priority",
    "parallel"
  ],
  "priority": "high",
  "effort": "M",
  "machine": "LOCAL",
  "slug": null,
  "blocks": [],
  "deps": [],
  "multiBlockApproved": false,
  "owner": {
    "sessionId": "48329f54-879b-4974-b249-320f78ee1e89",
    "mode": "W",
    "branch": "fix/core-6962-package-bank-popups",
    "worktree": "/Users/eugeniucozac/bsqgroup/rf-t6"
  },
  "supersededBy": null,
  "createdAt": "2026-08-21T15:30:40.434Z",
  "createdBy": "planning",
  "updatedAt": "2026-08-21T16:08:55.909Z",
  "startedAt": "2026-08-21T16:08:55.909Z",
  "completedAt": null,
  "statusHistory": [
    {
      "status": "backlog",
      "at": "2026-08-21T15:30:40.434Z",
      "by": "planning"
    },
    {
      "status": "running",
      "at": "2026-08-21T15:53:25.912Z",
      "by": "control-modeX"
    },
    {
      "status": "backlog",
      "at": "2026-08-21T16:01:27.304Z",
      "by": "control-modeX",
      "note": "restart from scratch: lane rejected at spawn by the account 5h usage limit (utilization 0.99 -> rejected, org overage disabled); no work committed; worktree + branch preserved for re-dispatch after the 19:00 BST reset"
    },
    {
      "status": "running",
      "at": "2026-08-21T16:08:55.909Z",
      "by": "control-modeX"
    }
  ],
  "qa": null,
  "ready": null,
  "livecheck": null,
  "needsManual": null,
  "userVerified": null,
  "report": null,
  "pr": null,
  "merge": null,
  "rejections": [],
  "proposalSource": null,
  "parent": null,
  "id": "T6",
  "num": 6
}
