{
  "schemaVersion": 1,
  "kind": "proposal",
  "title": "FAQ banner block missing entirely on /faqs/limited-by-guarantee/ and /faqs/limited-by-shares/",
  "body": "**Surfaced by T9 (CORE-7013) verification, 2026-08-24 — a DIFFERENT defect from that ticket.**\n\nCORE-7013 is about banner *resolution*. While sweeping all 23 FAQ topic pages to verify it,\ntwo pages turned out to have **no banner at all** on the clone, while live renders one.\n\n| Page | Live | Clone |\n|---|---|---|\n| `/faqs/limited-by-guarantee/` | banner, 800px master shown at 1170×252 | **no banner element** |\n| `/faqs/limited-by-shares/` | banner, 800px master shown at 1170×252 | **no banner element** |\n\nMeasured at viewport 1800 on both sites: on the clone neither page has any `<img>` wider than\n400px above y=700 (16 images present, widest is a 275×28 logo at y=1093). The other 21 FAQ\ntopic pages all render the banner correctly.\n\nMost likely the banner block was never added to these two pages in the CMS (a seeding gap),\nrather than a code defect — the shared template works on the other 21. Confirm in Payload\nbefore treating it as code.\n\n**Not fixed under T9**: T9 is scoped to resolution, its own acceptance criteria say the crop\nand block must otherwise stay as-is, and a missing block is a separate class of defect.",
  "acceptanceCriteria": [
    "`/faqs/limited-by-guarantee/` and `/faqs/limited-by-shares/` render the FAQ banner, matching live in position, crop and size (1170×250 at desktop).",
    "The banner image is served at ≥ its displayed size, consistent with the other 21 FAQ topic pages (1170×250 master).",
    "No change to the other 21 FAQ topic pages, which already render correctly.",
    "Verified at 360 / 768 / 1024 / 1800 against live."
  ],
  "status": "backlog",
  "track": "clone",
  "tags": [
    "bug"
  ],
  "priority": "normal",
  "effort": "S",
  "machine": "LOCAL",
  "slug": null,
  "blocks": [],
  "deps": [],
  "multiBlockApproved": false,
  "owner": null,
  "supersededBy": null,
  "createdAt": "2026-08-24T13:20:06.221Z",
  "createdBy": "claude",
  "updatedAt": "2026-08-24T13:20:06.221Z",
  "startedAt": null,
  "completedAt": null,
  "statusHistory": [
    {
      "status": "backlog",
      "at": "2026-08-24T13:20:06.221Z",
      "by": "claude"
    }
  ],
  "qa": null,
  "ready": null,
  "livecheck": null,
  "needsManual": null,
  "userVerified": null,
  "report": null,
  "pr": null,
  "merge": null,
  "rejections": [],
  "proposalSource": null,
  "parent": "T9",
  "id": "P2",
  "num": 2
}
